title,review,star
Overpriced but works as described,"I Initially gave this cup 1 star because it leaked. I called the 800 number and the manufacturer walked me through the correct placement of the handles, which corrected the leaking issue. The handles snap on and once on, should not be removed again. When correctly attached, the handles should slightly overlap the top rim of the cup.  I was also instructed not to fill the cup all the way to the fill line and to take apart the two parts of the lid for cleaning. NThat said, I still feel the cup is overpriced. Also, my father does not like that he has to tip his head so far back to sip from the cup.",3.0 out of 5 stars
The Provale Cup dispenses 1 Tbsp of un-thickened liquid at a time and it did satisfy his thirst until he was able to heal and ...,After my husband's series of seizures it left his esophagus damaged and he aspirated making it necessary to drink honey thickened fluids.  He has always be a huge water drinker and the thickened liquids did not quench his thirst at all.  The Provale Cup dispenses 1 Tbsp of un-thickened liquid at a time and it did satisfy his thirst until he was able to heal and drink liquids out of a normal cup again.,5.0 out of 5 stars
A truly amazing cup to assist my husband in swallowing without aspirating,A truly amazing cup to assist my husband in swallowing without aspirating. It would be helpful if it was a little less costly so I would be able to have more that 1.I have recommended this product to many people.Thanks again.,5.0 out of 5 stars
Overpriced,"This cup is overpriced considering the fact that it leaks non stop. I have to change my clients shirt any time she wants to drink anything other than water. For $36+ you'd think they could design this a little better. Breaks too easily, accidental drops are bound to happen with the population that need these devices.We're searching for another alternative rather than waste her limited funds on another of these.",2.0 out of 5 stars
Does Amazon want to keep customers?,"Unfortunately these cups were flawed in that the 2 handles could not be placed on the cup because it caused leakage. We were able to make it work with one handle. But for the price, it was a cheap product. Returning them was not an option. We tried other types but to no avail. We found ourselves returning items and now that Amazon has this new return policy...(too many returns will knock me off their customer list) we decided to keep this defective product.",3.0 out of 5 stars
Safe drinking but could be better designed.,"Since the product is the only one on the market that’s available to buy and ship to the EU, I understand that they are able to put their price so high and I thought if it is life saving coz my dad won’t drown himself while drinking it will be great. I have used the only other brand’s version before a lot and it was always leak proof and great but this one has a hole at the back of the rim of the lid which isn’t covered properly by the rim of the main cup.. I thought this was to stop vacuum but is way too big and more comes out of it there than the actual sipping opening of the cup. Which my dad noticed and started drinking out of there which made the whole cup pointless as it’s meant to only let 5mls out at once. The lid doesn’t click in and doesn’t screw on it’s a push on one but it doesn’t seem to go all the way on one side, I tried with a lot of force it’s annoying it doesn’t leak there though so the actual seal would be ok if it didn’t have a hole at the back. It’s good that the handles are removable, as first I put both on but my dad held it the wrong side and was trying to  drink with the sipping bit down... so I could remove and he can work is out now. He does often think that the opposite flap that we can use to open it is the bit where he should be drinking from it so I need to remind him that it’s the other way.Though, if the cup isn’t tipped backwards, it wouldn’t leak that much but it’s hard not to when someone is ill and has coordination problems.I tried to drink out of the cup several times and we used it with thickened fluids and I had to tip it almost 180 degrees to get all of the 5mls out but that makes it quite safe and when my dad does manage to use it it is a safe way of drinking for him so I’m happy to leave the cup with him to drink when unsupervised.Overall makes me feel safer about his drinking but could be better.",4.0 out of 5 stars
Disappointed with the cup,"This cup was purchased for my husband who has Parkinson's. His swallowing of liquids needs to controlled in by using a cup that delivers only 2 tablespoons of liquid at one time which it does. The problem with the cup is that it does leak when the person is lifting the cup to their mouth.  In order to get the liquid the person needs to lift and tilt the cup quite high. This is very difficult for someone with Parkinson's whose motor skills are weak. Also, the price of this cup is much too expensive.",2.0 out of 5 stars
$37 FA WHATTTT???,Can you say INEFFECTIVE ADULT SIPPY CUP. I bought this for my father who had stopped eating and drinking.  At a high recommendation I bought this cup as we were trying to reintroduce food and drink. The cup had oxymoron-ish directions and leaked. It was totally over priced for its ineffectiveness.  GARBAGE. I could have gone to the dollar store and bout a child's sippy cup with no leaks and no confusing directions.,1.0 out of 5 stars
This cup only works if the drinker has the ability to and knows how to suck through spout,"This cup is NOT for everyone who has a dysphagia diagnosis. The person must be able to such the drink through the spout. This cup does not act like a sippy cut that ""pours"" into the mouth.  I ordered this for my brother, but he is unable to use it. I feel this information should be included in the product description.",2.0 out of 5 stars
Not worth the money,"This cup needs to be redesigned? You can not fill it to the ""line"". By the way,the line is very hard to see . If you fill it all the way to the invisible line it leaks.It's a good idea if only it worked. In my case it's not worth the trouble or the expense,it is overpriced.",1.0 out of 5 stars
The Perfect Solution,"My husband recently suffered aspiration pneumonia and was cautioned to drink small sips of liquid at a time.  He has mobility issues with his hands so his caregiver and I were attempting to control the amount of liquid he could sip.  He had stopped drinking as much, which is not a good thing.  This cup, suggested by dysphagia staff at Huntington Memorial Hospital in Pasadena, CA, has been the perfect solution.  It works as described and the handles make it easy for my husband to handle the cup himself.  I don't have to worry that he is taking in too much liquid at a time.  I highly recommend this product.",5.0 out of 5 stars
Won't work with thickened beverages,Bought this for my wife who has serious swallowing problems. She can only drink thickened beverages. It wasn't until we received this and read the paperwork that we found this does NOT work with thickened beverages. And it is not returnable. So I am stuck with a $40 paperwight,1.0 out of 5 stars
Not a solution for my husband's dysphasia,"The cup was impossible to assemble, by me or the nurses in the nursing home, so I returned it.  Later he was giving one by a therapist in the nursing home, but it did not dispense enough liquid to be adequate for someone needing to push liquids to alleviate recurring UTI's.",2.0 out of 5 stars
Not worth the $ at all,"The cup leaks no matter what we do. My dad has to have nectar thick liquids after his stroke and it doesn't work at all with anything thick. The cup seems really cheaply made and cost is super high. If you can find another brand, do it!",1.0 out of 5 stars
it sorta works,"it does leak if you tilt it all the way up. If you drop it the lid comes off.it works........ ish and if you need one in a pinch.... and lets be honest, there is not much to choose from in this category. So if you need one, yeah but there is a lot of room for improvement.",2.0 out of 5 stars
Didn’t work as expected.,"Our doctor recommended the Provale cup after a swallow study.  This cup didn’t deliver measured liquid as expected. I purchased for my husband who has dysphasia due to progressive neurological disease.  He tried it for two weeks, but choked with most sips.  In order to get liquid out, he had to tip it to almost 90 degrees, and it sometimes leaked.  I felt we paid $36 for three pieces of plastic that just didn’t deliver what we needed.  Very disappointed.",1.0 out of 5 stars
Returned. Very bad design,Bad design. You have to tilt your head back to drink and that contributes to aspiration. Returned.,1.0 out of 5 stars
Product works great. We had to watch her to ensure she ...,"Purchased for my 93 year old mom while getting speech therapy for swallow issues. Product works great. We had to watch her to ensure she was only taking small sips, but this cup only lets her get small sips. This helped alleviate the worry out of having to constantly watch her. It is a bit hard to take apart for washing as it’s a snug fit, but it would leak if it were loose. Would highly recommend this product.",5.0 out of 5 stars
Dysphagia Cup,These cups have worked well for my mother who has Dysphagia.  They let her get off the thickened liquid that she hated and back onto water.The parts of the cup can be difficult to get apart and you have to be a little careful to keep from cracking the cup base. The brown lid cups I got release 1 tsp of fluid each time they are tipped up.,4.0 out of 5 stars
Really like these,Perfect for my husband.  He is on tube feeding because of having trouble swallowing.  We don’t have any problems with him getting to much fluids.,5.0 out of 5 stars
Love this cup,Love this cup it does what I need it to do. The price is too much. But it’s either this or add thickeners and my husband would rather not drink.,5.0 out of 5 stars
Pathetic excuse for a helpful device for stroke patients,"Pathetic device that leaked all over the front of my wife, a stroke victim,  this strikes me as cruel joke on those who have swallowing difficulty, would strongly recommend NOT purchasing this item.  To which is not eligible for returns",1.0 out of 5 stars
Leaks,"The lid to this expensive cup leaks, unfortunately, I was under a lot of stress and lost track of time since I purchased this product which came highly recommended and when I went to return it, it was past the 30-day policy.  upon the 1st 2 uses, noticed it leaked and spilled all over my now disabled father. The purpose of the cup is great for a stroke victim only if it did not leak from the lid.",1.0 out of 5 stars
Measures fluid to prevent chocking,Bought this for my 100 yr old mother with dementia.  It was recommended by a speech therapist.,5.0 out of 5 stars
Works good at delivering a small amount of liquid,"Was hard to snap together at first.  Works good at delivering a small amount of liquid.  I wish it was a bit more ""adult"" looking, but much better than a sippy cup for my teen just relearning how to drink/swallow.",4.0 out of 5 stars
This cup is WONDERFUL! My son has a tracheotomy and he has ...,"This cup is WONDERFUL! My son has a tracheotomy and he has problems with eating and drinking. This cup only allows a total of 10 cc. at a time and so that helps prevent him from taking too many fluids at one time and prevents aspiration. I had to buy this cup again because he threw his cup and it cracked... so I couldn't hardly wait to get another one back in.I would certainly suggest you try this cup if you might have the same problems as I have. It's not inexpensive, but certainly worth not having aspiration problems.",5.0 out of 5 stars
I bought this cup for my 92 year old Mother ...,"I bought this cup for my 92 year old Mother at the suggestion of her speech therapist.  She used it but balked about it.  We noticed her not drinking enough which could have resulted in dehydration.  We eventually gave into her wishes and gave her another type of cup. The cup performed well.  However, the top section broke at the bottom.  After going on their web site I surmised this happens frequently since they sell that portion separately.",4.0 out of 5 stars
Great cup for people that need this,Father-in-law is at an assisted living facility and needed one. He loves it.,5.0 out of 5 stars
Leaking :(,After the first use it started to leak. I have tried everything to make it not leak but it continues to leak out around the lid. I was excited for this product but disappointed in it since the first use.,1.0 out of 5 stars
Helps prevent choking from taking gulps,Does exactly what it’s supposed to do.,4.0 out of 5 stars
Broken cup.. Without even using it.,The cup broke around the rim when putting the handle on. During assembly. We couldn't even use the cup because it leaks now.,1.0 out of 5 stars
Fluid flow is Right,"However, the cups are large and elderly folks in assisted living facilities tend not to be able to tilt their heads back far enough to get the liquid flowing.  Expensive for plastic cup.  I bought sippy cups at Dollar Store for: . . . $1.",4.0 out of 5 stars
✅,Grandma didn’t like it,1.0 out of 5 stars
will not seal i,"I am not happy with this product, when my husband tries to drink it pours out to fast, if he happens to drop it, it will leak from both sides of the cup",2.0 out of 5 stars
Cup,I liked this product because the flow of water is much smaller,5.0 out of 5 stars
Recommend for certain individuals,Do not recommend ifnyou have difficulty tilting your head back.  Otherwise it’s a great product.,4.0 out of 5 stars
Perfect for dysphagia,Special cup recommended by my Dads speech pathologist. Works perfectly by delivering a tsp of water at a time to keep him from swallowing to much liquid at once,5.0 out of 5 stars
Worth every penny to prevent aspiration pneumonia.,Greatly reduces the risk for aspiration pneumonia to the point that we have bought 3 of these cups. It can save your life or someone you love. Worth every penny.,5.0 out of 5 stars
Dad lOves it,Helps with dysphalgia,5.0 out of 5 stars
For those who want a little sip,"It does exactly as it is advertised to do, thus, the reason for me purchasing it.",5.0 out of 5 stars
Great cup,Worked perfectly for my needs,5.0 out of 5 stars
Lid broke after less than 2 months,"My brother has to have this cup due to his disability causing swallowing issues.  He loves it, but the lid broke in less than two months of use-not very sturdy at all.  Disappointing :(",2.0 out of 5 stars
Terrible Cup,I would like a refund. this item doesnt allow enough water to get out. please contact me: anna_maestrini@yahoo.com to return,1.0 out of 5 stars
It was recommended by his speech therapist after he had a swallow ...,I ordered this for my cousin who has CP. It was recommended by his speech therapist after he had a swallow study performed. If you have a hard time tilting your head up or back then this cup is not for you. We need a cup that would only allow 10cc to enter but we found this cup is a mess for him. We are using a straw with his head tilted down. It just wasn't right for him but I like the idea and feature of it.,2.0 out of 5 stars
cup,Too expensive doesn't work well,1.0 out of 5 stars
Not made very good,Handles won't stay on & it drips! Not worth the money!!,1.0 out of 5 stars
There are better and cheaper options.,We purchased this cup for my father in law by request of his therapist. We received the cup and it leaks like crazy. We can’t return it because it is “ineligible for return” so now we’re stuck with a $30 paperweight.,1.0 out of 5 stars
Pricey,Pricey but worked,4.0 out of 5 stars
throat problems,works great for my son  now he doesn't choke when he takes a drink... would highly recommend this to anyone who has trouble swallowing.....,5.0 out of 5 stars
special cup,Everything is good except leaks at the seam,3.0 out of 5 stars
Great product - Provale cup,"Great for keeping swallows consistent. Used it for someone with swallowing difficulty. Users must put cup down between each sip, which may be difficult for those who tire easily",5.0 out of 5 stars
Leaks all over you,Leaks around the edges. We have never been able to completely use 1 time due to poor fitting of mouth piece to cup. Leaked everywhere.,1.0 out of 5 stars
Cracked lid,The lid cracked within a month of use. Too expensive!,1.0 out of 5 stars
If you're patriot loved one has dementia get them one of these before ...,If you're patriot loved one has dementia get them one of these before they get to sick. It really helped my Dad. Best to only use water in it but you can put other unthickened liquids into it if necessary.Worth every penny. I think everyone who gets dementia ought to be issued one of these sippy cups on the first day.,5.0 out of 5 stars
Must be as able to tilt cup to 90 degrees to work,"My father in law is 95 and to use this cup you have to tilt it at a 90 degree angle he can't do that, so it does not work for him.",1.0 out of 5 stars
expensive,simple devise but way to costly $36.00.  you can use a sippy cup 2.99 from walmart.,3.0 out of 5 stars
Can't use,My dad has Parkinson's so I got this for him because of his constant aspirations. He has been getting pneumonia from aspirating after drinking. Unfortunately he won't use this cup because it looks to much like a sippy cup for a toddler. I found one that he does use which looks like a regular cup but always keeps the liquid at the lip of the cup so the head never has to tilt back to drink. I'm sure this cup works just not for my dad,2.0 out of 5 stars
very bad both leaking,Bought 2 both leaked badly.  Had 2 others in the past with no problems.  These are terrible,1.0 out of 5 stars
"Poor quality, the rim of the lid cracked causing ...","Poor quality, the rim of the lid cracked causing the liquid to drip on to my mother's blouse, another reason for her to dislike using it.  Despite this I will order another to try to lower her risk of choking as I think it serves its purpose",3.0 out of 5 stars
Perfect,Great for the elderly,5.0 out of 5 stars
You need to be patient,"My husband is too impatient to use it, he would rather gulp and choke.",2.0 out of 5 stars
Three Stars,"Does ok, but leaks a lot.",3.0 out of 5 stars
Four Stars,Does not work with thickner,4.0 out of 5 stars
I was very disappointed in the cup,"I purchased the Provale 10cc cup for my 82 yr. old uncle who needs his liquids nectar thick. I was very disappointed in the cup. It did not work and it is not returnable because it is considered a hygiene product.  Too expensive to spend money on something that does not work, I threw the cup away.",3.0 out of 5 stars
Works as advertised,Works as advertised. At least 2 or 3 times a day my mom aspirates when drinking a liquid. The provale cup now makes sure she is not getting too much liquid in her mouth at one time.,5.0 out of 5 stars
The only good thing about this cup is that it delivers the ...,"The only good thing about this cup is that it delivers the perfect amount of liquid which its supposed to do but the worst thing is that it leaks as its tipped up to the mouth and very expensive. For the price of this cup, it should not be leaky at all",1.0 out of 5 stars
Need no moving parts,Too many pieces to be used in a nursing home setting...,1.0 out of 5 stars
Effective product,"Very, very impressed with this cup! My son has not choked on liquids thanks to the cup's small amount of liquid per sip. Some what difficult to separate the parts to wash, but well worth the effort. So pleased that a speech therapist told us about this product!",5.0 out of 5 stars
Good idea,It wasn't suitable for my brother in law condition.,3.0 out of 5 stars
good cup overall,this cup works well for controlling the amount of liquid but it will leak if the handles aren't exactly set correctly.,4.0 out of 5 stars
used in the past,used the product foy my 90 year old mother in the past. works as it says.,4.0 out of 5 stars
Opening up the item,Very hard top open especially for the elderly,2.0 out of 5 stars
Provale Cup to aid swallowing,This cup helps a lot and is worth getting. My husband chokes a lot due to a neurological disease and finds this cup helpful.,5.0 out of 5 stars
Not worth the money,"Bought this cup for my partner who had a massive stroke. The cup is okay for controlling the liquid intake, BUT it leaks around the seal. It's very difficult to tighten the seal, and drips coffee EVERYWHERE. As expensive as this cup is it should work like a charm. Also, I've noticed that the material its made of scratches really easy. I DO NOT own a dishwasher, I wash it with a sponge and I don't know how to explain it, but it's almost like the material is shedding, I do not believe this cup is worth the money. I wouldn't recommend it to anyone, due to the leaking and the way the cup is pealing around the lip, but it is okay for controlling intake of fluid",3.0 out of 5 stars
Wast of money.,Cheep cup for the price.,2.0 out of 5 stars
Five Stars,Very helpful in preventing aspiration.,5.0 out of 5 stars
Just a sip at a time!,Keeps individual from gulping down liquids! Increases her safety during meals.,5.0 out of 5 stars
One Star,The lid was hard to put on and leaked. It is not as hard to take off.,1.0 out of 5 stars
One Star,The cup is very petite and has leakage although closed.,1.0 out of 5 stars
DO NOT USE if you are worried about aspiration.,"While the idea of this product is great, the execution is not. We purchased this product for my 82 year old grandmother who has difficulty swallowing, she aspirates very easily; this has caused her lungs to become infected with pneumonia. The doctor in the hospital suggested that we try this cup which we promptly ordered. Upon receiving the cup I noticed three major flaws:The cup itself is quite large and was a bit cumbersome for her (she is small and currently quite weak from the pneumonia). It was difficult even to hold it myself and help her to drink from it.In the amount of time that it took that one small teaspoon to travel from the bottom of the dosing core to the mouth she took at least four breaths. The whole point of this cup was so that she wouldn't breathe in the liquid. If she is breathing while the liquid is being poured into her mouth then that defeats the purpose.The angle at which she had to tilt her head (all the way back) to finally get the liquid into her mouth is flat out dangerous. To avoid aspiration one is supposed to tilt their chin down, NOT all the way back.While this cup may work well for certain swallowing disorders, I DO NOT recommend that you try it when attempting to avoid aspiration.",1.0 out of 5 stars
Very helpful for my father in law,Completely satisfied,5.0 out of 5 stars
Four Stars,A good solution for swallow-challenged elderly.,4.0 out of 5 stars
Two Stars,My dad has been diagnosed with dysphagia & it made no difference in the drinking for him.,2.0 out of 5 stars
It break so easy. Don't waste your money,It break so easy. Don't waste your money.No star from me but I had to put this crappy star here.,1.0 out of 5 stars
Cup,Great product.,5.0 out of 5 stars
Excellent choice for stroke victims.,The Provale Cup was invaluable in helping my father during that most difficult time right after his mild stroke. Learning to swallow thin liquids is one of the hardest tasks after a stroke. The Provale Cup is an excellent choice to use during this time.,5.0 out of 5 stars
It works,My 90 yr old mom has dysphasia. Cup works great.,4.0 out of 5 stars
One Star,Too hard to put together.,1.0 out of 5 stars
"It worked fine, but needs a little more detail with the ...","Mother had a stroke and had swallowing problems. Dr. prescribed this cup. It worked fine, but needs a little more detail with the way it seals. She had problems with leaking lid.",5.0 out of 5 stars
Four Stars,just what was needed,4.0 out of 5 stars
Four Stars,It works as stated. Controls the amount of liquid you can drink.,4.0 out of 5 stars
So not worth the money. It leaks and the ...,So not worth the money.  It leaks and the lid is hard to get on and off.  Handle broke within a week.,2.0 out of 5 stars
Poor design for such an expense cup,Cup leaks and already cracked.  Poor design for such an expense cup.,1.0 out of 5 stars
Useful cup,Great for honey thickened liquid for children with dysphagia.,5.0 out of 5 stars
One Star,Waste of money. Very disappointed,1.0 out of 5 stars
Five Stars,This product worked just as I expected.  Well made.,5.0 out of 5 stars
A waste of money,Too much effort for too little liquid per sip. A waste  of money.,1.0 out of 5 stars
Five Stars,Perfect. Fast shipping. Thanks.,5.0 out of 5 stars
Works as expected..,Works fine.,3.0 out of 5 stars
One Star,This cup constantly leaks!,1.0 out of 5 stars
The cup is hard to use for both caregiver and ...,The cup is hard to use for both caregiver and patient. It is difficult for the patient to get enough liquid and cleaning it is a chore.,1.0 out of 5 stars
Five Stars,nice,5.0 out of 5 stars
Three Stars,Hard to handle,3.0 out of 5 stars
Good idea,Good idea but did not work well for my son. It just frustrated him on not getting amount he wanted.,2.0 out of 5 stars
Great cup,Perfect for the intended use .Great for patients with difficulty swallowing and keeping from aspiration.,5.0 out of 5 stars
Quality of product was good but the use of cup is not,Quality of product was good but the use of cup is not.  Alzheimer's patient could not tilt cup to drink and cup was very expensive.,3.0 out of 5 stars
