title,review,star
Provale cup 5 cc.,Not sure how my cousin managed but he could still suck down more that the 5cc when he wanted to.  He is now on honey thickened liquids so we can no longer use the Provale.,3.0 out of 5 stars
Still too much,Did not adequately regulate the flow.  Was not useful for us.,2.0 out of 5 stars
We use this cup everyday,"This cup delivered what was promised......doses out 5ml sips at a time.  The construction is solid and easy to take apart and clean.  My only complaint is that it does leak a bit when tipped up to drink.  We hold a towel under my daughter's chin anyway (because she doesn't fully swallow) so this leakage doesn't truly bother us.  I read other reviews that said the cup leaked so we were prepared.  Nevertheless, we use this cup everyday and it's great",4.0 out of 5 stars
Lid doesn't fit well.,Lid would not stay on. When lid is inserted into cup the long part of lid barely fits in.,2.0 out of 5 stars
Quality of Cup,"For the price,  I  thought the quality of the cup was only average.  I put it together correctly but it still wants to leak a little.  I also thought it would be insulated, but it's not.  It has improved my mother's choking , so that is helpful.",3.0 out of 5 stars
Great product!,"This product has been a tremendous life saver in the rehabilitation of my husband, after suffering a stroke.  He can drink from this without choking.It is overpriced somewhat, but I don't think the company has any competitors.BC",4.0 out of 5 stars
Leaks,Leaks!! Such a bummer!,1.0 out of 5 stars
Five Stars,Ok,5.0 out of 5 stars
Good product,Worked as advertised.,5.0 out of 5 stars
Five Stars,Bought this for my mother who had swallowing problems.  Worked as expected.,5.0 out of 5 stars
Two Stars,"Great cup, great idea just did not fit our personal needs.",2.0 out of 5 stars
Five Stars,Great item!,5.0 out of 5 stars
Four Stars,It does leak which is very aggravating!!  We HAVE to use it.Waaaay over-priced!!,4.0 out of 5 stars
"Hate it, my husband can't use","Hate it ,my husband can't use it",1.0 out of 5 stars
Pricey but works,I've only used it once and it did what it was supposed to.  Still think it's pricey for a plastic cup though.,5.0 out of 5 stars
provale cup,This item was recommended by speech therapist for a developmentally handicapped person.  He needs two of these for daily use.,5.0 out of 5 stars
This cup is worth buying for people with swallowing problems,"The cup is for my mother. She inhales food and drink into her lungs and needs to drink mostly nectar thick fluids. The cup allows her to drink regular consistency fluids without inhaling it into her lungs. It only allows the person to take one small sip at a time into the mouth. It can be confusing for an older person, as they have to bring the cup down to an upright position between each sip. She did get the hang of it, although when it gets to the bottom, we have to fill it to the fill line again because she can't get the last bit out. Its good, because most people do not like the nectar thick fluids -- especially the water.",4.0 out of 5 stars
Necessity for swallowing issues,"My husband was given a cup like this in the hospital when he was diagnosed w/ aspiration pneumonia which came from swallowing issues.  I then ordered him another so he could be drinking juice in one and water in the other.  Any other liquids he drank had to be thickened.  He has now relearned how to swallow properly so he is no longer using this cup, but it was essential for about 8 weeks.",4.0 out of 5 stars
Works as indicated,Works okay for little sips but not for normal long drinks. Not for thickened liquids as noted by others.WAY TOO PRICEY... Until there is a descent knock off this cup has the monopolyWe'll see how it holds up long term,4.0 out of 5 stars
Five Stars,Great product fast delivery,5.0 out of 5 stars
Provable cups,Greatly helped to go from thickened liquids to no thickened liquids,4.0 out of 5 stars
Five Stars,As described and shipped fast,5.0 out of 5 stars
Two Stars,for the price not worth it.,2.0 out of 5 stars
Three Stars,"leaks and cracks easily, not worth $35.00!!!",3.0 out of 5 stars
Three Stars,"Item received on time, however, the handle comes off when in use.",3.0 out of 5 stars
Three Stars,"It works well, but it is very overpriced for what it is.",3.0 out of 5 stars
Five Stars,Worked well. Shipping was fast.,5.0 out of 5 stars
Provale Cup,My husband needed the 5cc cup as his swallowing problems are getting worse. I originally bought the 10cc Provale Cup. The cups work well and reduce choking.,5.0 out of 5 stars
works great but if not sealed just right it does leak,"works great but if not sealed just right it does leak.  the speech therapist that recommended it said that 1 in 5 of hers leaked as well, sooooo  if you get a leaky one, try to re-seat it or exchange it and hopefully you will get one that fits better",3.0 out of 5 stars
doesn't feel like an adult,small cup...doesn't feel like an adult cup,1.0 out of 5 stars
I purchased these cups for a participant that I support ...,I purchased these cups for a participant that I support that has dysphagia. She reports the cups have worked well and have met her needs to prevent choking and aspiration. They have held up with daily usage,5.0 out of 5 stars
Excellent product,Excellent quality. Easy use for a dysphasia patient. Recommend .,5.0 out of 5 stars
Works as advertised with minor issue.,This is our second cup being used by my mother. On both cups the tab on the top has broken half off. That leaves a sharp edge. Otherwise they still work great.,5.0 out of 5 stars
Four Stars,It worked!,4.0 out of 5 stars
Terrible product,"DO NOT PURCHASE THIS PRODUCT!  Terrible design:  too big/heavy, mouth piece is too thick and causes dripping after attempting to drink from it.  The cup also spills from the lid other than the spout.  Company will not allow you to return the product once it's used.  (So tell me, how would you know if it works unless you use it?)A good company would stand behind their product; this one does not.I will never purchase from this company again.",1.0 out of 5 stars
I love having the technology of this cup to help him ...,Helps my husband to practice his swallows after a severe stroke. I love having the technology of this cup to help him back to full health.,5.0 out of 5 stars
I recommend this product to aid in swallowing and aspiration,"As a speech language pathologist specializing is dysphagia, I recommend this product to aid in swallowing and aspiration prevention",5.0 out of 5 stars
Provale Cup 5cc,Terrible.  Did not work the way I thought it would.  My father has to keep his head straight so he will not choke.  The only way to use this cup properly is to tilt your head way back.  Not good.,2.0 out of 5 stars
Does not work at all with any type of thickened ...,"Does not work at all with any type of thickened liquid.  It was difficult for my dad to use successfully, he was very frustrated.",1.0 out of 5 stars
GREAT CUP!,GREAT CUP!! Our daughter's speech therapist uses one with her and she recommended we get one for home. Works well and our daughter loves her special cup.,5.0 out of 5 stars
Swallow not choke,Great Item that does what it says.  Changed the ease of drinking without choking  I will and I have already recommended this product..,5.0 out of 5 stars
Five Stars,Good cups and a great price!,5.0 out of 5 stars
These blue 5 cc cups did not look nice after several weeks of washing by hand,"The cup works well for its purpose, i.e. to control amount of fluid in one drink.  These blue 5 cc cups did not look nice after several weeks of washing by hand.  Cups that we had purchased several years ago that were the brown 10 cc cups held up much nicer.",4.0 out of 5 stars
product as described,Very useful with individuals I work with who are developmentally disabled. Paces drinking; thereby reducing choking risk.  Will purchase again,5.0 out of 5 stars
Asperating,Used by mother in a nursing home and works well since she is bed ridden. Satisfied with cup. Nurses recommended cup to keep her from as operating water into her lungs.,4.0 out of 5 stars
Perfect!!,Exactly what we needed.  I work in an Elementary School and we ordered this item so our parent didn't have to send it back and forth to school everyday.Thanks!,5.0 out of 5 stars
Five Stars,"While the controlled amount may be frustrating for the user, it is clearly a beneficial tool for the caregiver.",5.0 out of 5 stars
I recommend it to others,"It is working very well for me, I recommend it to others.",5.0 out of 5 stars
cup to use when only small sips are to be taken to help improve swallowing ; cup only works with regular thin liquids,excellent cup for people with swallow difficulty/dysphagia which allows one teaspoon sized sip be taken at a time. recommend not to clean in dishwasher since cup lid does not fit well after cleaned and liquids leak out of cup.,5.0 out of 5 stars
Price,That's a lot of money for plastic pored in a mold.  It does do the job. Merry Christmas and Happy New Year,3.0 out of 5 stars
Is your cup leaking? They have a front and a back!,"I am a speech pathologist and regularly recommend and utilize this cup for my dysphagia patients. Recently made a realization that I think most people don't know. The cups have a front and a back. I have never ordered a brand new cup, I've only utilized existing ones, in the directions it mentions a vent. It is obvious on the lid, but very hard to see on the cup, I can only see it if I hold it up to the light, but you can feel it if you run your finger around the rim on the inside. It also helps to not fill the liquid all the way to the fill line. I have seen a few people ask about putting thickened liquids in these cups; they are for thin liquids only. Also, your loved one / patient will need decent range of motion in their neck/shoulder to utilize the cups. Hope this helps!",5.0 out of 5 stars
This works,My husband used one of these in the hospital due to swallowing difficulties after radiation for tongue cancer. He was choking a lot and getting fluid in his lungs and developed aspiration pneumonia and septic shock. This worked great in the hospital and I want to get him one as he refuses to use thickners in his drinks as advised. When I can afford one I will get him one. So overpriced!,5.0 out of 5 stars
This cup is overpriced and needs to include cleaning directions ...,"This cup is overpriced and needs to include cleaning directions. I have been cleaning the cup for almost three years and even with that, just found mold in the ""tube"" part of it.",2.0 out of 5 stars
"awesome, buy now","buy this item if u experience any difficulty swallowing. it holds enough to keep me satisfied all night. it's easily refilable,& gives me much needed independece (i can roll my weelchair up to my disability sink,& pour water directly into the drink spout) they're pretty durable(i need a new one about every 1.5 years,but i'm not a gentle customer, if it can hang a day with me it's a bit of awesomeness)",5.0 out of 5 stars
The most important thing should be quality and guarantee.,One of the two purchased leaks. need a replacement.,3.0 out of 5 stars
Excellent for adults with dysphagia,"This cup is the only product on the market that I am aware of- that reduces the flow administered during drinking.  I work with adults with developmental disabilities as well as adults with neuro and cognitive deficits, and this product is excellent in helping them reduce the amount of liquid that is swallowed per sip.  I find 5  cc's is desirable with most dysphagic patients who require this level of support.  It can occasionally leak, but I don't find that to be a major problem.  Sturdy design and goes through an industrial dish washer without issue.",5.0 out of 5 stars
Was recommended by my Fathers speech therapist,Was recommended by my Fathers speech therapist. Dad had trouble swallowing after his second stroke and this helped a lot. Worth the price to help prevent choking on liquids and aspiration.Because these portions are smaller you need to take extra precautions to insure the person using the cup is getting enough daily fluid intake.Arrived on time and in great condition.,5.0 out of 5 stars
just great..,"this cup is made of very fragile plastic....my disabled daughter accidentally dropped it after only having it 3 days....the whole top of the cup broke into pieces....just great....$35 cup that didn't last a week.....very disappointed ....they should make these out of more durable materials if they are going to sell to disabled people....accidents happen....i didn't bother with sending it back....just bought something different.....if you are going to be sitting right next to your child/adult and can be responsible for making sure it doesn't drop on the floor, it will probably work for you......but my daughter is on a self feeding program and this was supposed to help",2.0 out of 5 stars
Well worth the price for peace of mind.,"This cup has really made a difference for my father. And also for me because he rarely coughs when drinking liquids an now I don't worry as much about him choking on what ever it is that he's drinking. Professional quality,Great design, Seals tight with no leaking. Its tuff an durable like Tupperware. Dad's dropped it several times an the lid never came off, but it easy to remove an put back on. I'm sure it will last an very long time.",5.0 out of 5 stars
SAVE YOUR MONEY-DON'T BUY THIS!,"This was an expensive FAILURE! I was TRYING TO FILL this EXPENSIVE CUP with water on the FIRST DAY and the handle slipped off, the cup hit the tile floor and broke! I IMMEDIATELY wrote a note to Amazon, they got right back to me and I never did hear from the company I ordered it from. It is an item I can't even return! This product was a total waste of my money and time!",1.0 out of 5 stars
A great drinking utensil,"My husband uses this cup for all of his drinks due to COPD, which was highly recommended by the speech therapist in the hospital. He loves it.",5.0 out of 5 stars
it's great for swallowing problems,"My mother has a difficult time trying to figure out how to use it; it's great for swallowing problems, not so great for confused Alzheimer's patients with swallowing problems. It was a lot of money; I wouldn't say I got my money's worth.",3.0 out of 5 stars
I recommend this product to aid in swallowing and aspiration,"As a speech language pathologist specializing is dysphagia, I recommend this product to aid in swallowing and aspiration prevention",5.0 out of 5 stars
Good health,This helps with my husbands swallowing,5.0 out of 5 stars
These are a great option for people that have dysphagia and either want ...,"I'm a speech therapist, and I occasionally order these for my patients. These are a great option for people that have dysphagia and either want to be independent with their liquids or cannot always be supervised. I really like these mugs, and they're more reasonably priced than RiJo.",5.0 out of 5 stars
Na,Love it,5.0 out of 5 stars
Perfect,Perfect,5.0 out of 5 stars
Four Stars,"Wonderful cup, but sadly the top cap is useless with nectar thickened liquids.",4.0 out of 5 stars
Her doctor recommended this as a way to stop that,I bought one cup as they are a little expensive.  It is for my sister who swallows too much at  one time and some goes down the wrong way.  Her doctor recommended this as a way to stop that.  It works and I will probably buy more now that we have tried it.,5.0 out of 5 stars
This product was exactly what I was looking for. ...,"This product was exactly what I was looking for.  It is for a developmentally delay persons, so the style design is not a problem.  It works just as it should.",5.0 out of 5 stars
Works very well,This cup helped tremendously!!!  My husband really liked using it as it allowed him to control the amount.,5.0 out of 5 stars
Works but plastic breaks very easily.,"Does what it should but breaks so easily. Knocked off bedside table once, shatters mouth piece, which is bad for something so expensive, even for therapeutic products!",3.0 out of 5 stars
There must be a better way to help people with dysphagia,"Extremely frustrating to use, 10cc is way too small for a sip. Also when the level of fluid is low, even less goes in to the dispenser part of the cup. Cant keep anybody hydrated this way. Being so expensive  we returned it.There must be a better way to help people with dysphagia.We found some children/baby cups rom Contigo (TM) with a pop-up mouth piece where the diameter of the last part of the sipping tube is much smaller. We have been training our son to take smaller sips, swallow, breathe between sips. Works most of the time, but fo the time being must keep reminding him. Should sink in over time.",2.0 out of 5 stars
Five Stars,Dispenses the perfect amount of liquid.  Found this cup preferable to thickeners.,5.0 out of 5 stars
Provale Cup 5ML,"I am on a thickened liquid regime, and the Provale  Cup 5ml was recommended by the hospital. It cost a sinificant amount and now sits in a cupboard no longer used. I would recommend it not be used where thickened regimes are in use.",1.0 out of 5 stars
and the spout that the patient drinks from is hard to get a good lip seal around it,"The lid is difficult to get on and off, (no way will most nursing home staff want to use it due to difficulty getting it off and on to clean it), and the spout that the patient drinks from is hard to get a good lip seal around it.",1.0 out of 5 stars
Five Stars,Great value and good quality,5.0 out of 5 stars
Five Stars,Works great. Dad can drink thin liquids and not choke.,5.0 out of 5 stars
Awkward to open and close. Challenging for people with ...,"Awkward to open and close.  Challenging for people with Dementia issues to learn to use, so it can lead to frustration.",3.0 out of 5 stars
May be quality of life altering for someone aspirating - ...,May be quality of life altering for someone aspirating - maintain safety with thin liquids versus thickened liquids by control of amount.,4.0 out of 5 stars
Great!,Works great!,5.0 out of 5 stars
Use a teaspoon instead!,"It does what it is meant to, however, with the need to tilt your head back to sip, it defeats the purpose in assuring liquid is going down the right pipe. in swallowing. People that have swallowing problems need to hold the liquid in their mouth and tuck their chin before swallowing. Certainly not worth the money! The handles are basically useless. The top is not real secure.",1.0 out of 5 stars
Works great,"Bought for senior client, like the handles though a little too thin for client to hold,and they tend to come off easy. Other than that great product.",4.0 out of 5 stars
Durable,"Perfect for my grandma. If she gets mad, she can throw it and nothing leaks!",5.0 out of 5 stars
Too big for an infant and too expensive,"This cup may do what it says, dispense 5cc, but it's way to big for a small childwho is having swallowing problems.  We thought the $40 was way too expensive andonly bought it because a therapist recommended it...  We'll be putting ours on EBay soon.",2.0 out of 5 stars
Don't Bother,"The cup has an incomprehensible design.  It comes partially assembled and the handles, which must be inserted are prone to cracking.  My version had one handle cracked out of the box. The plastic feels flimsy and light weight.  It is not suited for daily use.The two-handed cup is too awkward for an elderly user to handle easily. One handle is an option; but it feels as though the handle will break off.The parts do not fit together well.  The work to fill the vessel seems way too complicated for the caregiver and/or user. Out of the box, I couldn't get it together or apart without a major struggle.I returned it as damaged; but I would have returned it in any event as unsuitable for my elderly mother.The return was promptly handled as was the refund.",1.0 out of 5 stars
provale cup,Provale has provided a safe way for my family member to enjoy his favorite beverages.  It is easy for him to use and clean up is easy as well.,5.0 out of 5 stars
It's a piece of garbage!,I need to send it back. It's a piece of garbage!,1.0 out of 5 stars
Simply amazing,"If you have dysphasia – trouble swallowing – and even good efforts result in chronic coughing as your lungs struggle to keep the stuff you don't swallow out of your windpipe, this cup is amazing. It is like living in a new world.The whole point of it is to deliver to you a very small amount of liquid, I believe it is a teaspoon at 5 cc. I had thought I was being careful in taking small sips as I ate, but this measured amount is much smaller than the sips I had been taking. Result? Eating a meal – of course, very small portions of food – WITHOUT COUGHING. A change in my standard of living, and in the risk of pneumonia. Far, far more than I had expected.An additional benefit… since you are not coughing after each sip, you can take sip after sip one right after the other! NO COUGHING!!!",5.0 out of 5 stars
Poorly Made,"I purchased several of these cups and within a few months, they are all broken. Very disappointing for such an expensive and medically necessary item.",1.0 out of 5 stars
Perfect,Perfect for disabled son with feeding problems. Came quickly.,5.0 out of 5 stars
Rubbish and expensive,Expensive and rubbish! Leaks and made it harder for my mum with advanced Parkinson's disease to drink out of.,1.0 out of 5 stars
Five Stars,Ridiculously expense but good quality produce and gives the correct measure to avoid gulping.,5.0 out of 5 stars
"was advised to get this by an OT, I ...","was advised to get this by an OT, I see why they don't provide them at this price, user found it difficult, will keep trying, a lot of money for something quite 'basic'",3.0 out of 5 stars
No good for Parkinsons disease,"No good for Parkinsons disease ,asked to get it by dietician ...Total waste of money as ,can t lift and tilt mug , when you have a bad day , as movements are restricted ..Very expensive for what it is !!",1.0 out of 5 stars
Rubbish,Broke already,1.0 out of 5 stars
Five Stars,Good quality - fast delivery - very satisfied.,5.0 out of 5 stars
Three Stars,Good product but quite expensive,3.0 out of 5 stars
Provale Cups are well established for Asphygia,"Provale Cups are well established for Asphygia, but people should know how to use them. The cup cover with the lip should be at 90 degree to the cup handles. This will prevent leaks. All other contraptions on the market are not recommended for swallowing problems. This is the second one I purchased for my dad, first one was 10 cc and this one is 5 cc. For hot liquids, I use 5 cc and for water and cold juices, I use 10 cc. Will buy again.",5.0 out of 5 stars
